{
  "$schema": "../scenario.schema.json",
  "schema_version": "1.0.0",
  "study_id": "INTERP-DIALOGUE-001A",
  "status": "INTERNAL_PREREGISTRATION_UNEXECUTED_NO_HUMAN_DATA",
  "family_id": "REL-BOUNDARY-001",
  "domain": "REL",
  "title": "Temporary distance request with stated future contact",
  "authority": {
    "artifact_role": "FUNCTIONAL_JURISDICTION_SCENARIO_FIXTURE",
    "source_status": "AUTHOR_ORIGIN_HYPOTHETICAL_VIGNETTE",
    "empirical_status": "NO_HUMAN_DATA",
    "mechanism_status": "OPEN",
    "output_status": "NO_CORRECT_OUTPUT"
  },
  "reserved_terms": {
    "Episode": "RESERVED_LARGE_TIME_UNIT_NOT_INSTANTIATED",
    "Narrative": "RESERVED_LARGE_TIME_UNIT_NOT_INSTANTIATED"
  },
  "target_scope": {
    "resolution": "resolved",
    "stable_entity_target_form_applicability": "OPEN_DISCRIMINATOR",
    "provisional_target_representation_status": "OUT_OF_SCOPE",
    "reason": "The vignette distinguishes one relationship partner, but whether a separate durable target-form residence is needed remains open."
  },
  "stimulus": {
    "kind": "utterance",
    "base_surface": "오늘은 좀 혼자 있고 싶어. 내일 연락할게.",
    "public_record": [
      {
        "id": "rel.record.temporary_distance",
        "statement": "The speaker requested time alone for the present period."
      },
      {
        "id": "rel.record.future_contact",
        "statement": "The speaker said that they would make contact the next day."
      },
      {
        "id": "rel.record.no_explicit_ending",
        "statement": "The utterance did not explicitly end the relationship."
      }
    ],
    "world_unknowns": [
      {
        "id": "rel.unknown.intent",
        "statement": "The speaker's actual intention is not established by the utterance alone."
      },
      {
        "id": "rel.unknown.followthrough",
        "statement": "Whether next-day contact will occur is not yet known."
      }
    ]
  },
  "factors": [
    {
      "factor_id": "reported_current_mood",
      "operational_source_kind": "vignette_reported_current_mood",
      "levels": [
        {
          "level_id": "reported_ordinary_mood",
          "descriptor": "The recipient reports an ordinary current mood.",
          "source_lane": "FIRST_PERSON_CONDITION_REPORT",
          "level_specific_public_record": [
            {
              "id": "rel.factor.mood.ordinary",
              "statement": "The recipient reports an ordinary current mood."
            }
          ]
        },
        {
          "level_id": "reported_low_mood",
          "descriptor": "The recipient reports a low current mood.",
          "source_lane": "FIRST_PERSON_CONDITION_REPORT",
          "level_specific_public_record": [
            {
              "id": "rel.factor.mood.low",
              "statement": "The recipient reports a low current mood."
            }
          ]
        }
      ]
    },
    {
      "factor_id": "target_history",
      "operational_source_kind": "vignette_relational_history",
      "levels": [
        {
          "level_id": "reliable_followthrough_history",
          "descriptor": "Across comparable prior boundary requests, this partner usually resumed contact when they said they would.",
          "source_lane": "VIGNETTE_HISTORY_RECORD",
          "level_specific_public_record": [
            {
              "id": "rel.factor.history.reliable",
              "statement": "Across comparable prior boundary requests, this partner usually resumed contact when they said they would."
            }
          ]
        },
        {
          "level_id": "unexplained_withdrawal_history",
          "descriptor": "Across comparable prior boundary requests, this partner repeatedly promised later contact and then remained unavailable without explanation.",
          "source_lane": "VIGNETTE_HISTORY_RECORD",
          "level_specific_public_record": [
            {
              "id": "rel.factor.history.withdrawal",
              "statement": "Across comparable prior boundary requests, this partner repeatedly promised later contact and then remained unavailable without explanation."
            }
          ]
        }
      ]
    },
    {
      "factor_id": "externally_cued_prior_material",
      "operational_source_kind": "vignette_externally_cued_material",
      "levels": [
        {
          "level_id": "cue_prior_small_care",
          "descriptor": "The vignette re-presents a prior small act in which the partner noticed a need and followed through.",
          "source_lane": "EXPERIMENTER_CUE",
          "level_specific_public_record": [
            {
              "id": "rel.factor.cue.small_care",
              "statement": "A prior small act of noticed need and follow-through is externally re-presented before the response probe."
            }
          ]
        },
        {
          "level_id": "cue_prior_unexplained_distance",
          "descriptor": "The vignette re-presents a prior occasion of unexplained distance by the partner.",
          "source_lane": "EXPERIMENTER_CUE",
          "level_specific_public_record": [
            {
              "id": "rel.factor.cue.unexplained_distance",
              "statement": "A prior occasion of unexplained distance is externally re-presented before the response probe."
            }
          ]
        }
      ]
    }
  ],
  "minimal_pair_contract": {
    "comparison_rule": "HAMMING_DISTANCE_ONE_FACTOR_LEVEL",
    "held_constant_across_cube": [
      "The exact base utterance",
      "The identity of speaker and recipient within the vignette",
      "The time at which the utterance is received",
      "The absence of any next-day outcome at the first observation",
      "Sleep, workload, response window, bodily demands, and available response time",
      "Both the prior small-care item and the prior unexplained-distance item exist in every cell; only which item is externally cued changes"
    ],
    "pair_specific_rule": "THE_TWO_NON_INTERVENED_FACTOR_LEVELS_MUST_MATCH"
  },
  "factor_contrast_contracts": [
    {
      "factor_id": "reported_current_mood",
      "source_lane": "FIRST_PERSON_CONDITION_REPORT",
      "held_constant_factor_ids": [
        "target_history",
        "externally_cued_prior_material"
      ],
      "public_record_effect": "LEVEL_SPECIFIC_PUBLIC_RECORD_ONLY",
      "registered_candidate_probe_domains": [
        "material_admission",
        "encounter_formation",
        "candidate_affordance",
        "later_reorganization"
      ],
      "must_remain_equal": [
        "base_utterance_and_world_unknowns",
        "target_history_record",
        "externally_presented_cue",
        "sleep_workload_response_window_and_bodily_demands"
      ],
      "open_discriminator_refs": [
        "rel.open.condition_placement",
        "rel.open.condition_cue_delayed_reorganization"
      ],
      "status": "OPEN_NO_EXPECTED_TRACE"
    },
    {
      "factor_id": "target_history",
      "source_lane": "VIGNETTE_HISTORY_RECORD",
      "held_constant_factor_ids": [
        "reported_current_mood",
        "externally_cued_prior_material"
      ],
      "public_record_effect": "LEVEL_SPECIFIC_PUBLIC_RECORD_ONLY",
      "registered_candidate_probe_domains": [
        "target_scoped_readout",
        "encounter_formation",
        "candidate_fit",
        "later_trace"
      ],
      "must_remain_equal": [
        "base_utterance_and_world_unknowns",
        "reported_current_mood",
        "externally_presented_cue",
        "existence_of_both_prior_cue_items"
      ],
      "open_discriminator_refs": [
        "rel.open.target_residence"
      ],
      "status": "OPEN_NO_EXPECTED_TRACE"
    },
    {
      "factor_id": "externally_cued_prior_material",
      "source_lane": "EXPERIMENTER_CUE",
      "held_constant_factor_ids": [
        "reported_current_mood",
        "target_history"
      ],
      "public_record_effect": "LEVEL_SPECIFIC_PUBLIC_RECORD_ONLY",
      "registered_candidate_probe_domains": [
        "material_admission",
        "encounter_formation",
        "candidate_generation",
        "later_reorganization"
      ],
      "must_remain_equal": [
        "base_utterance_and_world_unknowns",
        "reported_current_mood",
        "target_history_record",
        "existence_of_both_prior_cue_items"
      ],
      "open_discriminator_refs": [
        "rel.open.cue_role",
        "rel.open.condition_cue_delayed_reorganization"
      ],
      "status": "OPEN_NO_EXPECTED_TRACE"
    }
  ],
  "shared_contract": {
    "author_origin_possibilities": [
      {
        "id": "rel.author.temporary_boundary",
        "statement": "The utterance may be experienced as a temporary boundary that leaves future connection open.",
        "authority": "AUTHOR_ORIGIN_PHENOMENOLOGICAL_POSSIBILITY"
      },
      {
        "id": "rel.author.possible_withdrawal",
        "statement": "The same utterance may be experienced as possible relational withdrawal or as an unresolved mixture of distance and continuity.",
        "authority": "AUTHOR_ORIGIN_PHENOMENOLOGICAL_POSSIBILITY"
      }
    ],
    "phenomenological_expectations": [
      {
        "id": "rel.expect.range",
        "statement": "Temporary-boundary, rejection-leaning, mixed, and deferred interpretations are all permitted possibilities; none is an expected answer for a cell.",
        "authority": "NONEXHAUSTIVE_POSSIBILITY_NOT_EXPECTED_OUTPUT"
      },
      {
        "id": "rel.expect.surface_overlap",
        "statement": "Two people or two conditions may permit the same immediate acknowledgement without implying the same later trajectory.",
        "authority": "NONEXHAUSTIVE_POSSIBILITY_NOT_EXPECTED_OUTPUT"
      }
    ],
    "normative_invariants": [
      {
        "id": "rel.invariant.evidence",
        "statement": "Reported mood, target history, and an externally presented cue do not rewrite what was uttered or certify the speaker's intention; presenting a cue does not certify access or use.",